{
  "deedNumber": "DL-DEED-2026-991823",
  "parcelId": "SECTOR-62-NOIDA-PLOT-44",
  "propertyAddress": "Plot 44, Tech Zone IV, Sector 62, Noida, Uttar Pradesh, 201309",
  "ownerName": "Priya Sharma",
  "ownerDID": "did:trustchain:0x70997970c51812dc3a010c7d01b50e0d17dc79c8",
  "registrarAuthority": "State Land Registry & Digital Revenue Board",
  "registrarDID": "did:trustchain:0x2cb4f72907b1ec202a2f751da0286aa9ee2e3b33",
  "registeredAt": "2026-08-15T11:00:00Z",
  "areaSqMeters": 450.5,
  "geoCoordinates": "28.6280 N, 77.3649 E"
}
